{
  "meta": {
    "schemaVersion": "1.0.0",
    "title": "Bengaluru marriage evidence ledger",
    "jurisdiction": "Bengaluru, Karnataka, India",
    "asOf": "2026-08-31",
    "dataKind": "research",
    "disclaimer": "Independent research, not official advice. Public sources and known gaps are shown together; do not submit personal data through this ledger."
  },
  "agencies": [
    {
      "id": "agency_kar_stamps_ind32_marriage",
      "name": "Department of Stamps and Registration, Government of Karnataka",
      "shortName": "Karnataka Stamps & Registration",
      "officialUrl": "https://revenue.karnataka.gov.in/"
    },
    {
      "id": "agency_kaveri_ind32_marriage",
      "name": "Kaveri 2.0, Department of Stamps and Registration",
      "shortName": "Kaveri 2.0",
      "officialUrl": "https://kaveri.karnataka.gov.in/landing-page"
    },
    {
      "id": "agency_kar_stamps_ind32_marriage_workflow",
      "name": "Department of Stamps and Registration, Government of Karnataka",
      "shortName": "Karnataka Stamps & Registration",
      "officialUrl": "https://revenue.karnataka.gov.in/"
    },
    {
      "id": "agency_kaveri_ind32_marriage_workflow",
      "name": "Kaveri 2.0",
      "shortName": "Kaveri 2.0",
      "officialUrl": "https://kaveri.karnataka.gov.in/landing-page"
    }
  ],
  "scenarios": [
    {
      "id": "scenario_marriage_w_hma",
      "label": "HMA registration lead",
      "summary": "Read the HMA registration framework and Kaveri entry boundary for an already solemnized Hindu marriage.",
      "tags": [
        "hma",
        "marriage",
        "kaveri"
      ],
      "pathNodeIds": [
        "node_marriage_w_route",
        "node_marriage_w_hma",
        "node_marriage_w_kaveri",
        "node_marriage_w_outcome"
      ],
      "status": "partial"
    },
    {
      "id": "scenario_marriage_w_sma",
      "label": "SMA notice/solemnization lead",
      "summary": "Read the statutory notice and objection sequence for a civil marriage.",
      "tags": [
        "sma",
        "notice",
        "marriage"
      ],
      "pathNodeIds": [
        "node_marriage_w_route",
        "node_marriage_w_sma_notice",
        "node_marriage_w_sma_solemn",
        "node_marriage_w_outcome"
      ],
      "status": "partial"
    },
    {
      "id": "scenario_marriage_w_kaveri_reported",
      "label": "Unclassified Kaveri reports",
      "summary": "First-person reports whose statutory route is unknown; they are not evidence for either HMA or SMA.",
      "tags": [
        "marriage",
        "citizen-evidence",
        "route-unknown"
      ],
      "pathNodeIds": [
        "node_marriage_w_kaveri",
        "node_marriage_w_outcome"
      ],
      "status": "partial"
    }
  ],
  "sources": [
    {
      "id": "source_marriage_kar_act",
      "title": "General-site reference — Karnataka Marriages (Registration and Miscellaneous Provisions) Act, 1976",
      "publisher": "Government of Karnataka / India Code",
      "url": "https://www.indiacode.nic.in/indiacode/",
      "accessedAt": "2026-08-28",
      "type": "official_guidance",
      "notes": "Official India Code search result states the Act provides for uniform law and compulsory registration; PDF endpoint did not load in this pass. Legacy official endpoint was unavailable in the 2026-08-28 citation check; this live official entry point identifies the responsible service but does not reproduce every captured detail. This is a general-site reference, not claim-specific evidence. A more specific public document or endpoint was not verified on 2026-08-29; wording that depends only on this source is retained at Grade C or Unknown. IND-54: no claim-specific public URL could be located and verified on 2026-08-31; retained solely as a Grade C general-site reference."
    },
    {
      "id": "source_marriage_annual_report",
      "title": "Annual Report 2023-24 — Stamps and Registration Department",
      "publisher": "Government of Karnataka, Revenue Department",
      "url": "https://revenue.karnataka.gov.in/uploads/media_to_upload1712395448.pdf",
      "accessedAt": "2026-08-28",
      "type": "official_guidance",
      "notes": "Pages 95–101 identify marriage registration under HMA/SMA and Kaveri-2.0 implementation."
    },
    {
      "id": "source_marriage_kaveri",
      "title": "General-site reference — Kaveri 2.0 public landing page",
      "publisher": "Department of Stamps and Registration, Government of Karnataka",
      "url": "https://kaveri.karnataka.gov.in/landing-page",
      "accessedAt": "2026-08-28",
      "type": "official_portal",
      "notes": "Public entry URL recorded; login and application flow were not opened. This is a general-site reference, not claim-specific evidence. A more specific public document or endpoint was not verified on 2026-08-29; wording that depends only on this source is retained at Grade C or Unknown."
    },
    {
      "id": "source_marriage_w_report",
      "title": "Annual Report 2023-24 — Stamps and Registration Department",
      "publisher": "Government of Karnataka, Revenue Department",
      "url": "https://revenue.karnataka.gov.in/uploads/media_to_upload1712395448.pdf",
      "accessedAt": "2026-08-28",
      "type": "official_guidance",
      "notes": "Department report identifies HMA/SMA and Kaveri-2.0."
    },
    {
      "id": "source_marriage_w_kaveri",
      "title": "General-site reference — Kaveri 2.0 public landing page",
      "publisher": "Government of Karnataka, Stamps and Registration",
      "url": "https://kaveri.karnataka.gov.in/landing-page",
      "accessedAt": "2026-08-28",
      "type": "official_portal",
      "notes": "Landing route only; no login. This is a general-site reference, not claim-specific evidence. A more specific public document or endpoint was not verified on 2026-08-29; wording that depends only on this source is retained at Grade C or Unknown."
    },
    {
      "id": "source_ind32_marriage_citizen_kaveri_success_and_objections",
      "title": "Marriage Certificate at Kaveri Portal - My Experience",
      "publisher": "r/bangalore (Reddit)",
      "url": "https://www.reddit.com/r/bangalore/comments/1m3ygld/marriage_certificate_at_kaveri_portal_my/",
      "accessedAt": "2026-08-28",
      "publishedAt": "2025-07-19",
      "type": "citizen_evidence",
      "notes": "The post and comments contain several first-person Kaveri experiences, including a reported digitally signed certificate, objections, repeated e-sign/OTP activity and a payment-status anomaly. Each is anecdotal; no stated format, payment, route, timing or SRO practice is retained as a general requirement."
    },
    {
      "id": "source_ind48_kaveri_dashboard",
      "title": "Kaveri Online Services — public landing/dashboard (Marriage Registration selector)",
      "publisher": "Department of Stamps and Registration, Government of Karnataka",
      "url": "https://kaveri.karnataka.gov.in/landing-page#dashboard",
      "accessedAt": "2026-08-31",
      "type": "official_portal",
      "notes": "Current public interface observed 2026-08-31. The fragment is a research locator for the dashboard state; the live page is the landing-page route. Visible controls included Marriage Registration, date range, SRO list and dashboard metrics; no values were submitted."
    },
    {
      "id": "source_ind48_kaveri_faq_route",
      "title": "Kaveri Online Services — Marriage Registration FAQ: route and identity rules",
      "publisher": "Department of Stamps and Registration, Government of Karnataka",
      "url": "https://kaveri.karnataka.gov.in/landing-page#faq-marriage-registration",
      "accessedAt": "2026-08-31",
      "type": "official_guidance",
      "notes": "Current in-page Marriage Registration FAQ state observed 2026-08-31. FAQ answers are official interface guidance and are not treated as statutory text."
    },
    {
      "id": "source_ind48_kaveri_faq_documents",
      "title": "Kaveri Online Services — Marriage Registration FAQ: documents, witnesses and photos",
      "publisher": "Department of Stamps and Registration, Government of Karnataka",
      "url": "https://kaveri.karnataka.gov.in/landing-page#faq-marriage-documents",
      "accessedAt": "2026-08-31",
      "type": "official_guidance",
      "notes": "Same current landing page, with the FAQ document/photo/witness answers expanded as a read-only state. Fragment is a research locator, not a claimed separate server route."
    },
    {
      "id": "source_ind48_kaveri_faq_operations",
      "title": "Kaveri Online Services — Marriage Registration FAQ: payment, editing, rescheduling and certificate",
      "publisher": "Department of Stamps and Registration, Government of Karnataka",
      "url": "https://kaveri.karnataka.gov.in/landing-page#faq-marriage-operations",
      "accessedAt": "2026-08-31",
      "type": "official_guidance",
      "notes": "Same current landing page, with the FAQ operational answers expanded as a read-only state. No payment, appointment or submission was attempted."
    },
    {
      "id": "source_ind48_kaveri_faq_sakala",
      "title": "Kaveri Online Services — Marriage Registration FAQ: Sakala service answer",
      "publisher": "Department of Stamps and Registration, Government of Karnataka",
      "url": "https://kaveri.karnataka.gov.in/landing-page#faq-marriage-sakala",
      "accessedAt": "2026-08-31",
      "type": "official_guidance",
      "notes": "Same current landing page; the FAQ answer says the service is under Sakala and 1 working day. Dashboard separately showed PSGA 3 Day(s), retained as a contradiction."
    },
    {
      "id": "source_ind48_hma_act",
      "title": "The Hindu Marriage Act, 1955",
      "publisher": "Government of India / India Code",
      "url": "https://www.indiacode.nic.in/bitstream/123456789/1560/1/A1955-25Eng.pdf",
      "accessedAt": "2026-08-31",
      "type": "law",